{
  "skill": "small-power",
  "version": "2.0.0",
  "discipline": "electrical",
  "subdiscipline": "small-power",
  "chat_type": "drawing",
  "description": "Socket outlet layouts for general-purpose power circuits per BS 7671:2018+A2:2022 / IEC 60364 / KS 1700:2018 / NEC 2023 Article 210. Produces circuit topology (ring/radial/dedicated_radial), per-room socket placement, RCD posture, and circuit-to-room cross-references as structured IR. Hybrid model: circuits[] (with topology + ocpd + cable + RCD) + rooms[] (with sockets[] cross-referencing circuit_ids). Leaf skill v1.0 — produces small-power intent for downstream db-layout consumption; multi-skill consumption (earthing + fault-level) deferred to v1.1+.",
  "status": "production",
  "_v2_breaking_change_note": "v2.0.0 is a major bump as SIGNALING (NOT breakage). All v2.0 IR additions are additive: new building_diversity top-level field is OPTIONAL; new circuits[].ring_endpoints / fcu_spurs / ev_charge_metadata are conditional on existing fields (topology=ring / load_type=ev_charge_*). All v1.x examples were retrofitted at A.1 fix-pass with engineering-judgment ring_endpoints defaults + honest disclosure (3 examples: uk-3bed-dwelling, uk-3bed-with-cable-sizing, uk-bathroom-shaver-and-zone2-sockets). v1.x examples still validate against v2.0 schema. The bump signals: within-skill-depth program for small-power is CLOSED; small-power is now architecturally complete and PRODUCTION status. Pre-merge check at A.5 confirmed zero consumers of small-power were pinned to ^1.x at the time of the bump.",
  "licence": "MIT",
  "inputs_path": "inputs.json",
  "outputs": [
    "small-power-ir"
  ],
  "output_schema": "electrical/small-power/schemas/small-power-ir.schema.json",
  "produces_intents": [
    {
      "name": "small-power",
      "version": "1.0.0",
      "schema_path": "electrical/small-power/schemas/small-power-intent.schema.json"
    }
  ],
  "produces_intent_schema": "electrical/small-power/schemas/small-power-intent.schema.json",
  "consumes_intents": [
    {
      "skill_id": "cable-sizing",
      "intent_name": "cable-sizing",
      "version_constraint": "^1.0"
    },
    {
      "skill_id": "special-locations",
      "intent_name": "special-locations-zoning",
      "version_constraint": "^1.0",
      "trigger": "room.room_type IN ['bathroom', 'shower_room', 'swimming_pool_hall', 'sauna', 'medical_group_0_area', 'medical_group_1_ward', 'medical_group_2_theatre', 'external_landscape']",
      "consumed_fields": [
        "zones",
        "electrical_constraints",
        "compliant",
        "violation_count_critical",
        "non_compliance_flags",
        "anchor_source_summary"
      ]
    }
  ],
  "standards": [
    "shared/standards/electrical/BS7671/part7-special-locations.json",
    "shared/standards/electrical/BS7671/reg411-disconnection-times.json",
    "shared/standards/electrical/BS7671/reg411-rcd-requirements.json",
    "shared/standards/electrical/BS7671/diversity-factors.json",
    "shared/standards/electrical/IEC60364/part7-special-locations.json",
    "shared/standards/electrical/KS1700/part7-special-locations.json",
    "shared/standards/electrical/NFPA70/part7-special-locations.json",
    "shared/standards/drafting/BS1192/cad-layers.json",
    "shared/standards/drafting/AIA/cad-layers.json",
    "shared/standards/drafting/ISO19650/cad-layers.json",
    "shared/standards/drafting/ISO5457/sheet-sizes.json",
    "shared/standards/drafting/ISO5455/scales.json",
    "shared/standards/drafting/ISO7200/title-block-fields.json",
    "IET On-Site Guide 8th Edition Appendix A — Table A1 (building diversity + lift table per BLD-NN + DIV-NN rules)",
    "IET On-Site Guide 8th Edition §8.4.4 (ring final + radial topology, including AMD 2 FCU spur update per TOP-NN rules)",
    "IET Code of Practice for EV Charging Equipment Installation (4th Ed) (verified anchor for EV-NN rules + INV-18)",
    "BS EN 61851-1 + BS EN 62196 (EV charging equipment + plug/socket Type 2 Mennekes / CCS Combo 2)",
    "HTM 06-01 (NHS healthcare medical electrical — taken with §710 for medical IT cascade integration)"
  ],
  "ontology": [
    "shared/ontology/equipment/socket-types.json",
    "shared/ontology/room-types/office.json"
  ],
  "symbols": [
    "shared/symbols/electrical/sockets/"
  ],
  "calculations": [
    "shared/calculations/electrical/diversity-factor.json",
    "shared/calculations/electrical/zs-loop-impedance.json"
  ],
  "prompts": {
    "generator": "electrical/small-power/prompts/generator.md",
    "validator": "electrical/small-power/prompts/validator.md",
    "reviewer": "electrical/small-power/prompts/reviewer.md"
  },
  "evals": [
    "electrical/small-power/evals/eval-01-uk-happy-path.yaml",
    "electrical/small-power/evals/eval-02-no-rcd-exception.yaml",
    "electrical/small-power/evals/eval-03-validation-trap-ring-in-us.yaml",
    "electrical/small-power/evals/eval-04-rationale-block.yaml",
    "electrical/small-power/evals/eval-05-jurisdiction-citation-form.yaml",
    "electrical/small-power/evals/eval-06-ring-topology-by-jurisdiction.yaml",
    "electrical/small-power/evals/eval-07-special-locations-compliance.yaml",
    "electrical/small-power/evals/eval-08-cross-room-ring-integrity.yaml",
    "electrical/small-power/evals/eval-09-gfci-scope-us.yaml",
    "electrical/small-power/evals/eval-10-cable-sizing-intent-consumed.yaml"
  ],
  "examples": [
    "electrical/small-power/examples/uk-3bed-dwelling/",
    "electrical/small-power/examples/uk-3bed-with-cable-sizing/",
    "electrical/small-power/examples/us-residential-dwelling/",
    "electrical/small-power/examples/intl-open-plan-floor/",
    "electrical/small-power/examples/ke-nairobi-small-office/"
  ],
  "validation": [
    "electrical/small-power/validation/cross-reference-validation.yaml",
    "electrical/small-power/validation/topology-validation.yaml"
  ],
  "rules": [
    "electrical/small-power/rules/diversity-rules.yaml",
    "electrical/small-power/rules/rcd-rules.yaml",
    "electrical/small-power/rules/spacing-rules.yaml",
    "electrical/small-power/rules/special-locations-rules.yaml",
    "electrical/small-power/rules/topology-rules.yaml"
  ],
  "constraints": [
    "electrical/small-power/constraints/electrical.yaml"
  ]
}
