{
  "skill": "energy-statement",
  "version": "0.1.0",
  "status": "stub",
  "discipline": "compliance",
  "description": "Part L / SAP / SBEM energy performance statement and notional vs actual building comparison",
  "standards": [],
  "inputs": [],
  "outputs": [],
  "compatible_runtimes": [
    "DraftsMan >= 1.0",
    "Claude Code",
    "OpenClaw"
  ],
  "produces_intents": [],
  "consumes_intents": []
}
