{
  "skill": "lighting-layout",
  "version": "1.4.0",
  "discipline": "electrical",
  "subdiscipline": "lighting",
  "chat_type": "drawing",
  "description": "BS EN 12464-1:2021 compliant interior lighting layout. Produces luminaire placement, circuit assignment, switching positions, and annotation data as structured IR. Checks Part L efficacy, perimeter zone controls, LLMF conversion, IP suitability, and circuit load compliance.",
  "status": "production",
  "licence": "MIT",
  "inputs_path": "inputs.json",
  "outputs": [
    "lighting-layout-ir"
  ],
  "output_schema": "shared/schemas/electrical/lighting-layout-ir.schema.json",
  "produces_intents": [
    {
      "name": "lighting-layout",
      "version": "1.0.0",
      "schema_path": "electrical/lighting-layout/schemas/lighting-layout-intent.schema.json"
    }
  ],
  "produces_intent_schema": "electrical/lighting-layout/schemas/lighting-layout-intent.schema.json",
  "consumes_intents": [],
  "standards": [
    "shared/standards/lighting/BSEN12464/lux-levels.json",
    "shared/standards/electrical/BS7671/circuit-requirements.json",
    "shared/standards/electrical/BS7671/part-l-controls-reference.md",
    "shared/standards/lighting/emergency-lighting/BSEN1838.json"
  ],
  "ontology": [
    "shared/ontology/room-types/office.json",
    "shared/ontology/room-types/industrial.json",
    "shared/ontology/room-types/healthcare.json",
    "shared/ontology/room-types/education.json",
    "shared/ontology/room-types/retail.json"
  ],
  "symbols": [
    "shared/symbols/electrical/luminaires/",
    "shared/symbols/electrical/switching/"
  ],
  "calculations": [
    "shared/calculations/lighting/lumen-grid-solver.json",
    "shared/calculations/lighting/lumen-method-check.json",
    "shared/calculations/lighting/lumen-method.json"
  ],
  "prompts": {
    "generator": "electrical/lighting-layout/prompts/generator.md",
    "validator": "electrical/lighting-layout/prompts/validator.md",
    "reviewer": "electrical/lighting-layout/prompts/reviewer.md"
  },
  "evals": [
    "electrical/lighting-layout/evals/eval-01-office-happy-path.yaml",
    "electrical/lighting-layout/evals/eval-02-lux-below-minimum.yaml",
    "electrical/lighting-layout/evals/eval-03-missing-lumen-data.yaml",
    "electrical/lighting-layout/evals/eval-04-circuit-load-check.yaml",
    "electrical/lighting-layout/evals/eval-05-ceiling-grid-alignment.yaml",
    "electrical/lighting-layout/evals/eval-06-part-l-efficacy.yaml",
    "electrical/lighting-layout/evals/eval-07-initial-vs-design-lumens.yaml",
    "electrical/lighting-layout/evals/eval-08-rationale-block.yaml"
  ],
  "examples": [
    "electrical/lighting-layout/examples/office-open-plan/",
    "electrical/lighting-layout/examples/reception-lobby/",
    "electrical/lighting-layout/examples/warehouse-highbay/",
    "electrical/lighting-layout/examples/uk-undersized-lighting-vs-target/",
    "electrical/lighting-layout/examples/uk-multi-entrance-classroom/",
    "electrical/lighting-layout/examples/uk-part-l-fail-incandescent/",
    "electrical/lighting-layout/examples/uk-open-plan-office-10x8-dali/"
  ],
  "compatible_runtimes": [
    "DraftsMan >= 1.0",
    "Claude Code",
    "OpenClaw",
    "any-llm-agent"
  ],
  "changelog": "electrical/lighting-layout/CHANGELOG.md",
  "validation": [
    "electrical/lighting-layout/validation/emergency-validation.yaml",
    "electrical/lighting-layout/validation/lux-validation.yaml",
    "electrical/lighting-layout/validation/spacing-validation.yaml"
  ],
  "rules": [
    "electrical/lighting-layout/rules/control-rules.yaml",
    "electrical/lighting-layout/rules/emergency-rules.yaml",
    "electrical/lighting-layout/rules/placement-rules.yaml",
    "electrical/lighting-layout/rules/spacing-rules.yaml",
    "electrical/lighting-layout/rules/switching-rules.yaml"
  ],
  "constraints": [
    "electrical/lighting-layout/constraints/electrical.yaml",
    "electrical/lighting-layout/constraints/geometric.yaml",
    "electrical/lighting-layout/constraints/maintenance.yaml"
  ]
}
