{
  "skill": "lifts",
  "version": "0.1.0",
  "status": "stub",
  "discipline": "mechanical",
  "description": "Lift and escalator specification \u2014 traffic analysis, machine-room/MRL configuration, power supply coordination and code compliance",
  "standards": [],
  "inputs": [],
  "outputs": [],
  "compatible_runtimes": [
    "DraftsMan >= 1.0",
    "Claude Code",
    "OpenClaw"
  ],
  "produces_intents": [],
  "consumes_intents": []
}
