{
  "skill": "fire-damper-schedule",
  "version": "0.1.0",
  "status": "stub",
  "discipline": "fire-protection",
  "description": "Fire and smoke damper schedule across HVAC penetrations of fire compartments, with actuation type and fail-safe state",
  "standards": [],
  "inputs": [],
  "outputs": [],
  "compatible_runtimes": [
    "DraftsMan >= 1.0",
    "Claude Code",
    "OpenClaw"
  ],
  "produces_intents": [],
  "consumes_intents": []
}
