{
  "skill": "hot-cold-water",
  "version": "0.1.0",
  "status": "stub",
  "discipline": "plumbing",
  "description": "Hot and cold water distribution layouts",
  "standards": [],
  "inputs": [],
  "outputs": [],
  "compatible_runtimes": [
    "DraftsMan >= 1.0",
    "Claude Code",
    "OpenClaw"
  ],
  "produces_intents": [],
  "consumes_intents": []
}
