{
  "skill": "method-statement",
  "version": "0.1.0",
  "status": "stub",
  "discipline": "documents",
  "description": "Method statement production",
  "standards": [],
  "inputs": [],
  "outputs": [],
  "compatible_runtimes": [
    "DraftsMan >= 1.0",
    "Claude Code",
    "OpenClaw"
  ],
  "produces_intents": [],
  "consumes_intents": []
}
