{
  "skill": "ups",
  "version": "0.1.0",
  "status": "stub",
  "discipline": "electrical",
  "description": "UPS system layouts and SLD integration",
  "standards": [],
  "inputs": [],
  "outputs": [],
  "compatible_runtimes": [
    "DraftsMan >= 1.0",
    "Claude Code",
    "OpenClaw"
  ],
  "produces_intents": [],
  "consumes_intents": []
}
