{
  "skill": "controls",
  "version": "0.1.0",
  "status": "stub",
  "discipline": "mechanical",
  "description": "BMS and controls schematics",
  "standards": [],
  "inputs": [],
  "outputs": [],
  "compatible_runtimes": [
    "DraftsMan >= 1.0",
    "Claude Code",
    "OpenClaw"
  ],
  "produces_intents": [],
  "consumes_intents": []
}
