{
  "skill": "hydrant-layout",
  "version": "0.1.0",
  "status": "stub",
  "discipline": "fire-protection",
  "description": "Fire hydrant and hose reel layouts",
  "standards": [],
  "inputs": [],
  "outputs": [],
  "compatible_runtimes": [
    "DraftsMan >= 1.0",
    "Claude Code",
    "OpenClaw"
  ],
  "produces_intents": [],
  "consumes_intents": []
}
