{
  "skill": "electrode-design",
  "version": "0.1.0",
  "status": "stub",
  "discipline": "electrical",
  "description": "Soil-resistivity-driven earth-electrode geometry design (rod arrays, mat/grid, deep-driven systems) using Wenner 4-point soil-resistivity measurement to compute Ra and validate Reg 411.5.3 disconnection condition. Produces electrode-design intent consumed by earthing skill.",
  "standards": [],
  "inputs": [],
  "outputs": [],
  "compatible_runtimes": [
    "DraftsMan >= 1.0",
    "Claude Code",
    "OpenClaw"
  ],
  "produces_intents": [],
  "consumes_intents": []
}
