{
  "skill": "plumbing-schematic",
  "version": "0.1.0",
  "status": "stub",
  "discipline": "plumbing",
  "description": "Plumbing schematic diagrams",
  "standards": [],
  "inputs": [],
  "outputs": [],
  "compatible_runtimes": [
    "DraftsMan >= 1.0",
    "Claude Code",
    "OpenClaw"
  ],
  "produces_intents": [],
  "consumes_intents": []
}
